{
  "id": "mbg-cut",
  "pack": "id",
  "lean": "neutral",
  "status": "published",
  "headline": {
    "en": "The 2026 MBG Allocation Is Cut to Rp268 Trillion",
    "id": "Pagu MBG 2026 Dipangkas Menjadi Rp268 Triliun"
  },
  "original": {
    "text": "Pagu MBG 2026 dipangkas dari Rp335 triliun menjadi Rp268 triliun",
    "lang": "id"
  },
  "outlet": "Kompas.com",
  "published_date": "2026-06-06",
  "url": "https://money.kompas.com/read/2026/06/06/213559526/anggaran-mbg-terserap-rp-8815-triliun-hingga-mei-2026",
  "og": {
    "image_path": "/assets/og/mbg-cut.jpg",
    "fetched_at": "2026-07-28",
    "attribution": "Link preview image from Kompas.com, shown with the outlet name and an outbound link.",
    "fallback": false
  },
  "tags": [
    "no-denominator",
    "missing-link"
  ],
  "counts": {
    "missing": 2,
    "unsourced": 1,
    "disputed": 0,
    "supported": 1,
    "hidden": 6
  },
  "provenance": {
    "analyzed_by": "claude-fable-5",
    "narrated_by": "claude-opus-5[1m]",
    "source_count": 7,
    "computed_at": "2026-07-28",
    "run_id": "run-2026-07-29"
  },
  "family": {
    "skeleton": "the same budget lever reported as an arithmetic fact, which is what makes the family visible: one skeleton, two temperatures, two outlets",
    "members": [
      {
        "outlet": "Kompas.com",
        "headline": "Anggaran MBG Terserap Rp 88,15 Triliun hingga Mei 2026",
        "url": "https://money.kompas.com/read/2026/06/06/213559526/anggaran-mbg-terserap-rp-8815-triliun-hingga-mei-2026",
        "date": "2026-06-06"
      },
      {
        "outlet": "Databoks (Katadata)",
        "headline": "Realisasi Belanja MBG Tembus Rp88 Triliun sampai Mei 2026",
        "url": "https://databoks.katadata.co.id/ekonomi-makro/statistik/6a2653afd21cc/realisasi-belanja-mbg-tembus-rp88-triliun-sampai-mei-2026",
        "date": "2026-05"
      },
      {
        "outlet": "Antara News",
        "headline": "Purbaya sebut realisasi anggaran MBG capai Rp88,15 triliun",
        "url": "https://www.antaranews.com/berita/5595513/purbaya-sebut-realisasi-anggaran-mbg-capai-rp8815-triliun",
        "date": "2026-06-05"
      }
    ]
  },
  "scaffold_default": "S2",
  "sparring": {
    "questions": [
      {
        "move": "mechanism",
        "q": {
          "en": "This chain has three steps. Which one does a source in this run actually state?",
          "id": "Dalam rangkaian artikel ini, langkah mana yang punya sumber yang menyatakannya?"
        },
        "options": [
          {
            "en": "That the programme kept running on 29,679 SPPG kitchens and its spending stood at Rp88.15 trillion through May 2026.",
            "id": "Bahwa program tetap berjalan dengan 29.679 dapur SPPG dan belanjanya tercatat Rp88,15 triliun hingga Mei 2026."
          },
          {
            "en": "That the Rp268 trillion ceiling is what the programme has been spending against since the cut.",
            "id": "Bahwa pagu Rp268 triliun itulah acuan belanja program sejak pemangkasan."
          },
          {
            "en": "That the rest of 2026 runs on a smaller spending envelope.",
            "id": "Bahwa sisa tahun 2026 berjalan dengan ruang belanja yang lebih kecil."
          }
        ],
        "correct": 0,
        "note": {
          "en": "The claim map marks the middle step as the only one carrying a quotation: Kompas published \"Anggaran MBG Terserap Rp 88,15 Triliun hingga Mei 2026\", and Antara carries the same figure attributed to Finance Minister Purbaya Yudhi Sadewa. The steps to its left and its right have no source stating them yet.",
          "id": "Peta klaim menandai sambungan tengah sebagai satu-satunya yang punya kutipan: Kompas memuat \"Anggaran MBG Terserap Rp 88,15 Triliun hingga Mei 2026\", dan Antara memuat angka yang sama dengan atribusi kepada Menteri Keuangan Purbaya Yudhi Sadewa. Dua sambungan di kiri dan kanannya belum punya sumber yang menyatakannya."
        }
      },
      {
        "move": "denominator",
        "q": {
          "en": "Inside the articles themselves, what is the Rp88.15 trillion through May 2026 measured against?",
          "id": "Di dalam artikel-artikelnya sendiri, angka Rp88,15 triliun hingga Mei 2026 diukur terhadap apa?"
        },
        "options": [
          {
            "en": "Against total state spending of Rp3,842.7 trillion in the 2026 budget.",
            "id": "Terhadap total belanja negara APBN 2026 sebesar Rp3.842,7 triliun."
          },
          {
            "en": "Against the MBG ceiling after the cut, Rp268 trillion, and the room left in it.",
            "id": "Terhadap pagu MBG setelah pemangkasan, Rp268 triliun, berikut sisa ruangnya."
          },
          {
            "en": "Against nothing: the articles carry the cumulative figure on its own.",
            "id": "Tidak terhadap apa pun: artikelnya memuat angka kumulatifnya saja."
          }
        ],
        "correct": 2,
        "note": {
          "en": "The Rp3,842.7 trillion denominator comes from the scale panel, not from the reporting. Inside the articles the May figure stands on its own, and the hidden element records the Rp268 trillion ceiling as the denominator nobody sets beside it, along with the room left for the months after May.",
          "id": "Pembagi sebesar Rp3.842,7 triliun itu datang dari panel skala, bukan dari artikelnya. Di dalam artikel, angka Mei berdiri sendiri; elemen tersembunyi mencatat pagu Rp268 triliun sebagai pembagi yang tidak pernah disandingkan, berikut ruang yang tersisa untuk bulan-bulan sesudahnya."
        }
      },
      {
        "move": "incidence",
        "q": {
          "en": "The rest of 2026 runs on a smaller envelope. Who does that reach before it reaches anyone at a ministry desk?",
          "id": "Sisa tahun 2026 berjalan dengan ruang belanja yang lebih kecil. Siapa yang lebih dulu merasakannya, sebelum siapa pun di meja kementerian?"
        },
        "options": [
          {
            "en": "Bondholders, since debt interest sits in the same budget.",
            "id": "Pemegang surat utang negara, karena bunga utang berada di APBN yang sama."
          },
          {
            "en": "Kitchen partners billing per portion, their crews, and the suppliers they buy from.",
            "id": "Mitra dapur yang menagih per porsi, para pekerjanya, dan pemasok tempat mereka membeli bahan."
          },
          {
            "en": "The auditors reconciling the May figure.",
            "id": "Auditor yang mencocokkan angka realisasi Mei."
          }
        ],
        "correct": 1,
        "note": {
          "en": "The claim map keeps four groups outside the chain: SPPG partners and their crews on payment terms, upstream suppliers whose income this spending is, recipients for the remaining months, and the kitchens and regions still queued. They stand at the end of the money, which is where a change in the envelope arrives first. Debt interest appears on the scale panel as its own line, not as a claim on what MBG has left.",
          "id": "Peta klaim menaruh empat pihak di luar rangkaiannya: mitra dapur SPPG dan pekerjanya yang menunggu termin pembayaran, pemasok hulu yang menerima belanja itu sebagai pendapatan, penerima manfaat untuk bulan-bulan sesudahnya, serta dapur dan daerah yang masih mengantre. Mereka berdiri di ujung aliran uangnya, dan di situlah perubahan ruang belanja tiba lebih dulu. Bunga utang muncul di panel skala sebagai pos tersendiri, bukan sebagai tagihan atas sisa anggaran MBG."
        }
      }
    ]
  },
  "prediction_tap": {
    "prompt": {
      "en": "Before you open the panels: a budget line gets cut, and the story reports how much of it has been spent. Which side of that goes missing?",
      "id": "Sebelum panelnya terbuka: sebuah pos anggaran dipangkas, lalu beritanya memuat berapa yang sudah dibelanjakan. Sisi mana dari cerita itu yang tidak ikut dimuat?"
    },
    "options": [
      {
        "en": "The budget line that receives the room the cut freed up.",
        "id": "Pos APBN yang menerima ruang fiskal hasil pemangkasan."
      },
      {
        "en": "The ceiling the spending figure is measured against, and what remains of it.",
        "id": "Pagu yang menjadi acuan angka belanja itu, dan sisa yang masih ada di dalamnya."
      },
      {
        "en": "The kitchen partners, crews and suppliers who bill against what remains.",
        "id": "Mitra dapur, para pekerjanya, dan pemasok yang menagih dari sisa itu."
      },
      {
        "en": "The recipients for the rest of the year, and the households behind them.",
        "id": "Penerima manfaat untuk sisa tahun, dan rumah tangga di belakang mereka."
      }
    ]
  },
  "panels": [
    {
      "type": "claim_map",
      "el_id": "mbg-cut.panel.claim_map",
      "spine": [
        {
          "el_id": "mbg-cut.spine.n1",
          "label": {
            "en": "The 2026 MBG budget ceiling is cut to a lower level",
            "id": "Pagu anggaran MBG 2026 dipangkas ke tingkat yang lebih rendah"
          },
          "value": {
            "amount": 268,
            "unit": "IDR_T",
            "display": {
              "en": "Rp268 trillion",
              "id": "Rp268 triliun"
            },
            "source_id": "id-antara-mbg-realisasi-mei2026",
            "as_of": "2026 allocation after the cut, as reported 5 June 2026"
          }
        },
        {
          "el_id": "mbg-cut.spine.n2",
          "label": {
            "en": "The programme keeps running and draws down its budget",
            "id": "Program tetap berjalan dan membelanjakan anggarannya"
          },
          "value": {
            "amount": 29679,
            "unit": "count",
            "display": {
              "en": "29,679 SPPG kitchens",
              "id": "29.679 dapur SPPG"
            },
            "source_id": "id-kompas-mbg-sppg-mei2026",
            "as_of": "as of end May 2026"
          }
        },
        {